{"apiVersion":"custos.dev/connector-manifest/v1","kind":"ConnectorManifest","metadata":{"contractVersion":"1","type":"oci-registry","version":"2.3.1-akv.1"},"spec":{"capabilities":["oci.pull","oci.push","oci.tag"],"credentials":{"authentication":{"connectorIdentity":"azure://managed-identity/custos-connector-mi","secretRef":"https://custos-akv.vault.azure.net/secrets/registry-token"},"authenticationType":"azure-key-vault"},"description":"OCI registry connector using Azure Key Vault for secret material.","events":{"delivery":["push","pull"],"produced":["oci.image.pushed","oci.tag.updated"],"pull":{"cursorEncoding":"oci-list-tags-v1","initialCursorBehavior":"now"}},"target":{"config":{"repositoryNamespace":"team-a"},"endpoint":"https://myorg.azurecr.io","kind":"oci-registry","verifyTls":true}}}
