{"apiVersion":"custos.dev/connector-manifest/v1","kind":"ConnectorManifest","metadata":{"contractVersion":"1","type":"amazon-s3-bucket","version":"1.0.0-irsa.1"},"spec":{"capabilities":["s3.read","s3.write"],"credentials":{"authentication":{"connectorIdentity":"aws://iam-role/custos-s3-connector-role","secretRef":"arn:aws:kms:us-east-1:123456789012:key/12345678-1234-1234-1234-123456789012"},"authenticationType":"amazon-kms"},"description":"Amazon S3 connector using workload identity (IRSA).","events":{"delivery":["pull"],"produced":["s3.object.created","s3.object.deleted"],"pull":{"cursorEncoding":"s3-list-objects-v1","initialCursorBehavior":"now"}},"target":{"config":{"bucket":"custos-artifacts-prod","region":"us-east-1"},"endpoint":"https://s3.us-east-1.amazonaws.com","kind":"amazon-s3-bucket","verifyTls":true}}}
